<TheEducationalCenter xmlns:xsi="http://www.w3.org/2001/XMLSchema-instance"
  xsi:noNamespaceSchemaLocation="Report.xsd">

  <studentProfiles>
    <student id="1">
      <fullName>string</fullName>
      <city>string</city>
      <email>asd@gmail.com</email>
      <startDate>2008-09-29</startDate>
      <contractSigned>true</contractSigned>
      <curriculumId>1</curriculumId>
      <taskResults>
        <!--1 or more repetitions:-->
        <taskResult>
          <status>Assignment Accepted</status>
          <!--Optional:-->
          <grade>3</grade>
        </taskResult>

      </taskResults>
    </student>
  </studentProfiles>

  <info>
    <curriculumProfiles>
      <!--1 or more repetitions:-->
      <curriculum id="1">
        <title>Shortened curriculum</title>
        <author>string</author>
        <creationDate>2006-08-19+04:00</creationDate>
        <courseList>
          <!--1 or more repetitions:-->
          <course>
            <id>1</id>
          </course>
        </courseList>
      </curriculum>
    </curriculumProfiles>

    <courseProfiles>
      <!--1 or more repetitions:-->
      <course id="1">
        <title>Course "Struts Framework Technology"</title>
        <author>string</author>
        <creationDate>2013-05-22+04:00</creationDate>
        <courseTasksList>
          <!--1 or more repetitions:-->
          <taskId id="1">
            <id>1</id>
          </taskId>
        </courseTasksList>
      </course>
    </courseProfiles>

    <taskProfiles>
      <!--Zero or more repetitions:-->
      <task id="1" type="Theory">
        <title>string</title>
        <duration>201</duration>
      </task>
    </taskProfiles>
  </info>

</TheEducationalCenter>